{
  "id": "v1-deep-ocean-brass",
  "parent_slug": "17-luxury-indoor-pool",
  "name": "v1-deep-ocean-brass",
  "project": {
    "name": "v1-deep-ocean-brass",
    "zh": "",
    "area": 0,
    "location": "Hong Kong",
    "budgetHKD": 0,
    "style": "",
    "palette": []
  },
  "renders": [
    {
      "id": "bar-lounge",
      "file": "/assets/mvps/17-luxury-indoor-pool/variants/v1-deep-ocean-brass/renders/bar-lounge.webp",
      "title": "Bar Lounge",
      "tag": "bar-lounge"
    },
    {
      "id": "pool-overview",
      "file": "/assets/mvps/17-luxury-indoor-pool/variants/v1-deep-ocean-brass/renders/pool-overview.webp",
      "title": "Pool Overview",
      "tag": "pool-overview"
    },
    {
      "id": "spa-zone",
      "file": "/assets/mvps/17-luxury-indoor-pool/variants/v1-deep-ocean-brass/renders/spa-zone.webp",
      "title": "Spa Zone",
      "tag": "spa-zone"
    },
    {
      "id": "top-down",
      "file": "/assets/mvps/17-luxury-indoor-pool/variants/v1-deep-ocean-brass/renders/top-down.webp",
      "title": "Top Down",
      "tag": "top-down"
    }
  ],
  "floorplan": null,
  "moodboard": null,
  "hero_img": "/assets/mvps/17-luxury-indoor-pool/variants/v1-deep-ocean-brass/hero.webp",
  "thumb_img": "/assets/mvps/17-luxury-indoor-pool/variants/v1-deep-ocean-brass/thumb.webp",
  "zones": [],
  "pricing": {
    "HK": {
      "label": "Hong Kong",
      "currency": "HK$",
      "perM2": 0,
      "rows": [],
      "total": 0
    }
  },
  "energy": {
    "eui": 0,
    "limit": 150,
    "annual": 0,
    "engine": "EnergyPlus"
  },
  "compliance": {
    "HK": {
      "code": "HK_BEEO_BEC_2021",
      "checks": [],
      "verdict": "—"
    }
  },
  "editable": {
    "area_m2": 40,
    "insulation_mm": 60,
    "glazing_uvalue": 2.0,
    "lighting_cct": 3000,
    "lighting_density_w_m2": 10,
    "wwr": 0.25,
    "region": "HK"
  },
  "derived": {
    "eui_kwh_m2_yr": 0,
    "cost_total": 0,
    "cost_per_m2": 0,
    "co2_t_per_yr": 0
  }
}