{
  "id": "v2-modern-chinese",
  "parent_slug": "arch-11-nt-family-house",
  "name": "v2-modern-chinese",
  "project": {
    "name": "v2-modern-chinese",
    "zh": "",
    "area": 0,
    "location": "Hong Kong",
    "budgetHKD": 0,
    "style": "",
    "palette": []
  },
  "renders": [
    {
      "id": "birds-eye",
      "file": "/assets/mvps/arch-11-nt-family-house/variants/v2-modern-chinese/renders/birds-eye.webp",
      "title": "Birds Eye",
      "tag": "birds-eye"
    },
    {
      "id": "front-elevation",
      "file": "/assets/mvps/arch-11-nt-family-house/variants/v2-modern-chinese/renders/front-elevation.webp",
      "title": "Front Elevation",
      "tag": "front-elevation"
    },
    {
      "id": "interior-living",
      "file": "/assets/mvps/arch-11-nt-family-house/variants/v2-modern-chinese/renders/interior-living.webp",
      "title": "Interior Living",
      "tag": "interior-living"
    },
    {
      "id": "street-corner",
      "file": "/assets/mvps/arch-11-nt-family-house/variants/v2-modern-chinese/renders/street-corner.webp",
      "title": "Street Corner",
      "tag": "street-corner"
    }
  ],
  "floorplan": null,
  "moodboard": null,
  "hero_img": "/assets/mvps/arch-11-nt-family-house/variants/v2-modern-chinese/hero.webp",
  "thumb_img": "/assets/mvps/arch-11-nt-family-house/variants/v2-modern-chinese/thumb.webp",
  "zones": [],
  "pricing": {
    "HK": {
      "label": "Hong Kong",
      "currency": "HK$",
      "perM2": 0,
      "rows": [],
      "total": "0",
      "totalNumber": 0,
      "subtotal": "0",
      "mep": "0",
      "prelim": "0",
      "cont": "0"
    }
  },
  "energy": {
    "eui": 0,
    "limit": 150,
    "annual": 0,
    "engine": "EnergyPlus"
  },
  "compliance": {
    "HK": {
      "code": "HK_BEEO_BEC_2021",
      "label": "HK · BEEO 2021",
      "checks": [],
      "items": [],
      "verdict": "—",
      "score": ""
    }
  },
  "editable": {
    "area_m2": 40,
    "insulation_mm": 60,
    "glazing_uvalue": 2.0,
    "lighting_cct": 3000,
    "lighting_density_w_m2": 6,
    "wwr": 0.25,
    "region": "HK"
  },
  "derived": {
    "eui_kwh_m2_yr": 0,
    "cost_total": 0,
    "cost_per_m2": 0,
    "co2_t_per_yr": 0
  }
}