{
  "id": "v1-nordic-cabin",
  "parent_slug": "lakeside-retreat",
  "name": "v1-nordic-cabin",
  "project": {
    "name": "湖畔度假民宿 · V1 北欧木屋",
    "zh": "湖畔度假民宿 · V1 北欧木屋",
    "area": 0,
    "location": "Hong Kong",
    "budgetHKD": 6000000,
    "style": "nordic-cabin, scandinavian, pine-wood, white-walls, floor-to-ceiling-windows, cozy-warm",
    "palette": [
      {
        "name": "wall_white",
        "hex": "#F5F0E8"
      },
      {
        "name": "pine_wood",
        "hex": "#C4A46C"
      },
      {
        "name": "dark_wood_accent",
        "hex": "#5C4033"
      },
      {
        "name": "glass_blue",
        "hex": "#B8D4E8"
      },
      {
        "name": "stone_gray",
        "hex": "#8E8E8E"
      }
    ]
  },
  "renders": [
    {
      "id": "birds-eye",
      "file": "/assets/mvps/lakeside-retreat/variants/v1-nordic-cabin/renders/birds-eye.webp",
      "title": "Birds Eye",
      "tag": "birds-eye"
    },
    {
      "id": "front-elevation",
      "file": "/assets/mvps/lakeside-retreat/variants/v1-nordic-cabin/renders/front-elevation.webp",
      "title": "Front Elevation",
      "tag": "front-elevation"
    },
    {
      "id": "interior-living",
      "file": "/assets/mvps/lakeside-retreat/variants/v1-nordic-cabin/renders/interior-living.webp",
      "title": "Interior Living",
      "tag": "interior-living"
    },
    {
      "id": "street-corner",
      "file": "/assets/mvps/lakeside-retreat/variants/v1-nordic-cabin/renders/street-corner.webp",
      "title": "Street Corner",
      "tag": "street-corner"
    }
  ],
  "floorplan": null,
  "moodboard": "/assets/mvps/lakeside-retreat/variants/v1-nordic-cabin/moodboard.webp",
  "hero_img": "/assets/mvps/lakeside-retreat/variants/v1-nordic-cabin/hero.webp",
  "thumb_img": "/assets/mvps/lakeside-retreat/variants/v1-nordic-cabin/thumb.webp",
  "zones": [],
  "pricing": {
    "HK": {
      "label": "Hong Kong",
      "currency": "HK$",
      "perM2": 8200,
      "rows": [
        {
          "cat": "1",
          "desc": "roof",
          "sub": "Roof — RC roof + 60mm XPS + membrane (U≤0.50)",
          "qty": "300.0",
          "amt": "m2"
        },
        {
          "cat": "2",
          "desc": "stair",
          "sub": "Stairs (1 flights) — RC stair flight (one floor) + railing",
          "qty": "1.0",
          "amt": "flight"
        }
      ],
      "total": 0
    }
  },
  "energy": {
    "eui": 128.5,
    "limit": 150,
    "annual": 77100,
    "engine": "EnergyPlus"
  },
  "compliance": {
    "HK": {
      "code": "HK_BEEO_BEC_2021",
      "checks": [
        {
          "name": "Envelope Exterior Wall U-value",
          "value": "0.555",
          "limit": "1.8",
          "unit": "W/m2K",
          "status": "pass",
          "note": ""
        },
        {
          "name": "Envelope Roof U-value",
          "value": "0.498",
          "limit": "0.8",
          "unit": "W/m2K",
          "status": "pass",
          "note": ""
        },
        {
          "name": "Envelope Window U-value",
          "value": "2.0",
          "limit": "5.8",
          "unit": "W/m2K",
          "status": "pass",
          "note": ""
        },
        {
          "name": "Envelope Window SHGC",
          "value": "0.6",
          "limit": "0.6",
          "unit": "—",
          "status": "pass",
          "note": ""
        },
        {
          "name": "Envelope OTTV (Overall Thermal Transfer Value)",
          "value": "needs facade analysis",
          "limit": "25.0",
          "unit": "W/m2",
          "status": "pass",
          "note": "OTTV requires detailed facade WWR + orientation data — not yet calculated."
        },
        {
          "name": "Lighting Lighting Power Density",
          "value": "6.0",
          "limit": "10.0",
          "unit": "W/m2",
          "status": "pass",
          "note": ""
        },
        {
          "name": "Ventilation Fresh Air (ACH)",
          "value": "0.5",
          "limit": "0.5",
          "unit": "ACH",
          "status": "pass",
          "note": ""
        }
      ],
      "verdict": "—"
    }
  },
  "editable": {
    "area_m2": 40,
    "insulation_mm": 60,
    "glazing_uvalue": 2.0,
    "lighting_cct": 3000,
    "lighting_density_w_m2": 11,
    "wwr": 0.25,
    "region": "HK"
  },
  "derived": {
    "eui_kwh_m2_yr": 128.5,
    "cost_total": 0,
    "cost_per_m2": 8200,
    "co2_t_per_yr": 0
  }
}