{
  "id": "v2-neo-chinese",
  "parent_slug": "lakeside-retreat",
  "name": "v2-neo-chinese",
  "project": {
    "name": "湖畔度假民宿 · V2 新中式庭院",
    "zh": "湖畔度假民宿 · V2 新中式庭院",
    "area": 0,
    "location": "Hong Kong",
    "budgetHKD": 6000000,
    "style": "neo-chinese, courtyard, gray-tile, white-wall, timber-lattice, moon-gate",
    "palette": [
      {
        "name": "wall_white",
        "hex": "#EDE8DF"
      },
      {
        "name": "gray_tile",
        "hex": "#5A5A5A"
      },
      {
        "name": "dark_wood",
        "hex": "#3E2723"
      },
      {
        "name": "lattice_wood",
        "hex": "#6D4C41"
      },
      {
        "name": "stone_base",
        "hex": "#9E9E9E"
      }
    ]
  },
  "renders": [
    {
      "id": "birds-eye",
      "file": "/assets/mvps/lakeside-retreat/variants/v2-neo-chinese/renders/birds-eye.webp",
      "title": "Birds Eye",
      "tag": "birds-eye"
    },
    {
      "id": "front-elevation",
      "file": "/assets/mvps/lakeside-retreat/variants/v2-neo-chinese/renders/front-elevation.webp",
      "title": "Front Elevation",
      "tag": "front-elevation"
    },
    {
      "id": "interior-living",
      "file": "/assets/mvps/lakeside-retreat/variants/v2-neo-chinese/renders/interior-living.webp",
      "title": "Interior Living",
      "tag": "interior-living"
    },
    {
      "id": "street-corner",
      "file": "/assets/mvps/lakeside-retreat/variants/v2-neo-chinese/renders/street-corner.webp",
      "title": "Street Corner",
      "tag": "street-corner"
    }
  ],
  "floorplan": null,
  "moodboard": "/assets/mvps/lakeside-retreat/variants/v2-neo-chinese/moodboard.webp",
  "hero_img": "/assets/mvps/lakeside-retreat/variants/v2-neo-chinese/hero.webp",
  "thumb_img": "/assets/mvps/lakeside-retreat/variants/v2-neo-chinese/thumb.webp",
  "zones": [],
  "pricing": {
    "HK": {
      "label": "Hong Kong",
      "currency": "HK$",
      "perM2": 7800,
      "rows": [
        {
          "cat": "1",
          "desc": "roof",
          "sub": "Roof — RC roof + 60mm XPS + membrane (U≤0.50)",
          "qty": "300.0",
          "amt": "m2"
        },
        {
          "cat": "2",
          "desc": "stair",
          "sub": "Stairs (1 flights) — RC stair flight (one floor) + railing",
          "qty": "1.0",
          "amt": "flight"
        }
      ],
      "total": "0",
      "totalNumber": 0,
      "subtotal": "0",
      "mep": "0",
      "prelim": "0",
      "cont": "0"
    }
  },
  "energy": {
    "eui": 135.2,
    "limit": 150,
    "annual": 81120,
    "engine": "EnergyPlus"
  },
  "compliance": {
    "HK": {
      "code": "HK_BEEO_BEC_2021",
      "label": "HK · BEEO 2021",
      "checks": [
        {
          "name": "Envelope Exterior Wall U-value",
          "value": "0.555",
          "limit": "1.8",
          "unit": "W/m2K",
          "status": "pass",
          "note": ""
        },
        {
          "name": "Envelope Roof U-value",
          "value": "0.498",
          "limit": "0.8",
          "unit": "W/m2K",
          "status": "pass",
          "note": ""
        },
        {
          "name": "Envelope Window U-value",
          "value": "2.0",
          "limit": "5.8",
          "unit": "W/m2K",
          "status": "pass",
          "note": ""
        },
        {
          "name": "Envelope Window SHGC",
          "value": "0.6",
          "limit": "0.6",
          "unit": "—",
          "status": "pass",
          "note": ""
        },
        {
          "name": "Envelope OTTV (Overall Thermal Transfer Value)",
          "value": "needs facade analysis",
          "limit": "25.0",
          "unit": "W/m2",
          "status": "pass",
          "note": "OTTV requires detailed facade WWR + orientation data — not yet calculated."
        },
        {
          "name": "Lighting Lighting Power Density",
          "value": "6.0",
          "limit": "10.0",
          "unit": "W/m2",
          "status": "pass",
          "note": ""
        },
        {
          "name": "Ventilation Fresh Air (ACH)",
          "value": "0.5",
          "limit": "0.5",
          "unit": "ACH",
          "status": "pass",
          "note": ""
        }
      ],
      "items": [
        {
          "name": "Envelope Exterior Wall U-value",
          "value": "0.555",
          "limit": "1.8",
          "unit": "W/m2K",
          "status": "pass",
          "note": ""
        },
        {
          "name": "Envelope Roof U-value",
          "value": "0.498",
          "limit": "0.8",
          "unit": "W/m2K",
          "status": "pass",
          "note": ""
        },
        {
          "name": "Envelope Window U-value",
          "value": "2.0",
          "limit": "5.8",
          "unit": "W/m2K",
          "status": "pass",
          "note": ""
        },
        {
          "name": "Envelope Window SHGC",
          "value": "0.6",
          "limit": "0.6",
          "unit": "—",
          "status": "pass",
          "note": ""
        },
        {
          "name": "Envelope OTTV (Overall Thermal Transfer Value)",
          "value": "needs facade analysis",
          "limit": "25.0",
          "unit": "W/m2",
          "status": "pass",
          "note": "OTTV requires detailed facade WWR + orientation data — not yet calculated."
        },
        {
          "name": "Lighting Lighting Power Density",
          "value": "6.0",
          "limit": "10.0",
          "unit": "W/m2",
          "status": "pass",
          "note": ""
        },
        {
          "name": "Ventilation Fresh Air (ACH)",
          "value": "0.5",
          "limit": "0.5",
          "unit": "ACH",
          "status": "pass",
          "note": ""
        }
      ],
      "verdict": "—",
      "score": "7/7 passed"
    }
  },
  "editable": {
    "area_m2": 40,
    "insulation_mm": 60,
    "glazing_uvalue": 2.0,
    "lighting_cct": 3000,
    "lighting_density_w_m2": 11,
    "wwr": 0.25,
    "region": "HK"
  },
  "derived": {
    "eui_kwh_m2_yr": 135.2,
    "cost_total": 0,
    "cost_per_m2": 7800,
    "co2_t_per_yr": 0
  }
}